apartment,area,floor,lease_mode,orientation,price,quarters,renovation,title
3室2厅2卫,136平米,中层,整租,东南,4800,"越秀可逸锦苑,海珠,江南西,距2号线江南西站约482米,江南西路杏园大街98、100号",精装修,越秀可逸江畔 3室越秀可逸江畔 家，就应该是这种感觉
2室2厅1卫,65平米,高层,整租,南,3800,"海富花园一期,海珠,江燕路,距2号线江泰路站约420米,江南大道南江燕路20号",精装修,江燕路 海富花园 近地铁 电梯精装两房 拎包可入住
2室2厅1卫,86平米,高层,整租,东南,5200,"富力银禧花园,海珠,滨江东,距8号线中大站约977米,海珠区滨江东路怡趣街",豪华装修,富力银禧花园 东南向豪华装修两房 实景拍摄 全新入住 超新超干净
2室1厅1卫,85平米,高层,整租,东,4350,"金豪嘉苑,海珠,滨江东,距8号线鹭江站约674米,海珠区下渡路184号",简装修,金豪嘉苑 两房 家具家电齐全 遇见就不要错过啦
1室1厅1卫,34平米,高层,整租,北,3000,"双子星城,海珠,新港西,距8号线中大站约742米,新港西路144号",豪华装修,双子星城，户型正气，装修干净清爽，价格划算
1室1厅1卫,36平米,低层,整租,北,2280,"滨江中路小区,海珠,滨江中,距6号线团一大广场站约1019米,海珠滨江中路地段",精装修,滨江中路 江边社区 一房一厅 装修保养新 拎包入住
2室1厅1卫,68平米,中层,整租,北,3000,"江南苑,海珠,工业大道北,距广佛线沙园站约408米,荔福路33号",精装修,江南苑精装修2室出租，先到先得！
2室1厅1卫,85平米,中层,整租,南北,5800,"花城湾畔,海珠,滨江东,距6号线团一大广场站约770米,滨江中路380号",豪华装修,惊爆！花城湾畔豪装2室 温馨舒适 只需5800元 租中
3室2厅2卫,104平米,高层,整租,南,5500,"光大花园,海珠,工业大道北,距广佛线沙园站约510米,工业大道北榕景路122号",精装修,光大花园小高层 园林花园小区 精装三房带主套 业主初次出租
2室2厅1卫,80平米,高层,整租,南,3500,"昌岗中路149号大院,海珠,昌岗路,距8号线宝岗大道站约291米,昌岗中路149号",精装修,昌岗地铁口 精装两房 家私全齐 拎包即住 交通方便
2室1厅1卫,50平米,低层,整租,东南,2600,"市二宫小区,海珠,江南大道,距2号线市二宫站约85米,市二宫地铁口附近",中装修,市二宫地铁站800米，精装修两房一厅
1室1厅1卫,28平米,中层,整租,南,2600,"海意名苑,海珠,前进路,距2号线市二宫站约365米,复兴六巷31号45号49号",精装修,新装修 家私家电齐 近地铁 光线好 小区管理
2室1厅1卫,63平米,中层,整租,南,2600,"南洲花苑,海珠,南洲,距2号线南洲站约977米,广州大道南南洲北路",精装修,南洲花苑 步梯两房 精装修 签合同即入住 一家几口优选考虑
3室2厅2卫,117平米,中层,整租,东南,6500,"中海名都,海珠,滨江中,距2号线市二宫站约808米,滨江中纺织路1号",豪华装修,中海名都 精装3室 户型正气 装修干净清爽 拎包入住
1室1厅1卫,52平米,高层,整租,南,3600,"丽影华庭,海珠,客村,距8号线客村站约122米,新港中路354号",精装修,丽影广场 52大一房 好房源不容错过 随时看房
2室1厅1卫,76平米,中层,整租,南,3000,"市二宫小区,海珠,江南大道,距2号线市二宫站约85米,市二宫地铁口附近",豪华装修,小区低层大两房，拎包入住，豪华装修，5近地铁
2室2厅1卫,70平米,高层,整租,北,3000,"第一金碧花园,海珠,工业大道南,距2号线东晓南站约845米,工业大道南821号",精装修,金碧花园 双地铁精装修大两房仅租3000/月
2室2厅1卫,89平米,高层,整租,东,5000,"泓景花园,海珠,赤岗,距8号线赤岗站约788米,赤岗北路18号",精装修,赤岗 泓景花园 佳信花园 珠江帝景 帝景华苑 保利天悦 领江壹号
3室1厅1卫,108平米,中层,整租,南,5500,"元邦明月园,海珠,赤岗,距8号线赤岗站约755米,赤岗东路231号",精装修,元邦明月园 欧式风格 精装三房 时尚大气 南向家电齐全 拎包入住
2室1厅1卫,72平米,中层,整租,南,3400,"聚德花苑,海珠,赤岗,距3号线大塘站约974米,赤岗大塘聚德路13至15号",简装修,大塘聚德花园 电梯精装二房一厅 温馨时尚的设计 住家的享受
3室1厅1卫,88平米,低层,整租,东南,5000,"宝岗大厦,海珠,宝岗,距8号线凤凰新村站约686米,宝岗路251号",精装修,家私家电齐全 小区管理 采光好 生活便利
2室2厅1卫,86平米,中层,整租,南,4800,"芭堤水岸,海珠,滨江东,距8号线鹭江站约974米,滨江东路环月街2号",精装修,芭堤水岸 精装温馨2房 家私家电齐全 全新装修 干净整洁 随时看房
3室2厅1卫,99平米,中层,整租,南,3300,"得胜岗大院,海珠,江南大道,距2号线江南西站约198米,江南大道中151至160号",精装修,"阿叔说没有这个价钱是不会租的,他说五年前就已经租这个价钱了"
3室2厅2卫,102平米,中层,整租,南,5500,"芭堤水岸,海珠,滨江东,距8号线鹭江站约974米,滨江东路环月街2号",豪华装修,芭堤水岸 精装3房 景视野开阔 采光好 交通购物方便看房方便
1室1厅1卫,40平米,中层,整租,南,2600,"海珠海逸半岛,海珠,工业大道北,距8号线凤凰新村站约532米,革新路新民五街48号",简装修,海逸半岛 电梯一房一厅 家电齐全 干净舒适 随时看房
2室2厅2卫,98平米,中层,整租,南,3500,"怡安花园,海珠,滨江中,距2号线市二宫站约570米,怡安路200至286号",中装修,市二宫铁地附近 大两房两厅 两个卫生 房大厅大 全明格局
1室1厅1卫,46平米,高层,整租,北,3500,"基立北街小区,海珠,前进路,距2号线江南西站约710米,前进路111至118号",精装修,前进路 万国广场旁 精装电梯一房一厅 不靓不收钱
2室2厅1卫,65平米,高层,整租,南,3400,"第二金碧花园,海珠,工业大道南,工业大道南821号",精装修,工业大道南金碧二期 精装电梯高层安静两房 干净整洁 温馨舒适
2室1厅1卫,76平米,中层,整租,南北,3800,"江南花园,海珠,宝岗,距广佛线沙园站约814米,宝岗大道马冲桥居仕地1号",精装修,也许您还在为找好房子而犯愁，不是没有，是您没有碰到好的经纪人
3室2厅2卫,117平米,中层,整租,南北,8000,"丽景湾,海珠,滨江东,距8号线鹭江站约967米,滨江东路907号",简装修,丽景湾 豪华装修3室好房出租 舒适安静 拎包即住
1室1厅1卫,45平米,中层,整租,西南,2300,"金丰花园,海珠,赤岗,赤岗路175号",中装修,金丰花园 低层温馨舒适一房一厅 家私电器齐全 少有放租 拎包入住
2室1厅1卫,87平米,中层,整租,南,6800,"芭堤水岸,海珠,滨江东,距8号线鹭江站约974米,滨江东路环月街2号",简装修,芭堤水岸 电视塔 珠江新城，地铁10距离
3室2厅1卫,107平米,中层,整租,东南,4000,"海富花园,海珠,江燕路,距2号线江泰路站约420米,江南大道南江燕路20号",精装修,海富花园 精装电梯三房带主套 仅租4000 配套齐全随时入住
3室1厅1卫,132平米,高层,整租,南,5200,"光大花园六期(H区),海珠,工业大道北,距广佛线沙园站约208米,工业大道北榕景路",精装修,光大花园 高大上豪装3房带主套 鸟语花香 领包入住
3室2厅2卫,110平米,中层,整租,南,4600,"光大花园,海珠,工业大道北,距广佛线沙园站约510米,工业大道北榕景路122号",精装修,光大花园 温馨舒适三房 东南向 采光好通风
3室2厅2卫,135平米,中层,整租,东北,8000,"芭堤水岸,海珠,滨江东,距8号线鹭江站约974米,滨江东路环月街2号",豪华装修,滨江怡苑芭堤水岸 3居室豪装 家具家电齐全 环境优雅
1室1厅1卫,45平米,低层,整租,南,2100,"沙地直街小区,海珠,滨江东,距6号线东湖站约1044米,滨江东路沙地直街",精装修,可视频直播看房 远安新街 二楼 一房一厅 拎包入住 实拍图
2室2厅1卫,84平米,中层,整租,西北,4800,"元邦明月园,海珠,赤岗,距8号线赤岗站约755米,赤岗东路231号",精装修,元邦明月园精装大2居环境没的说一个字 好! 装修两个字 更好
2室2厅1卫,89平米,高层,整租,东南,3000,"翠城花园,海珠,昌岗路,距8号线宝岗大道站约269米,海珠区昌岗路与宝岗大道交汇处",豪华装修,翠城花园 家私家电齐 干净舒适漂亮 屋子通风采光好
3室2厅1卫,150平米,中层,整租,东南,5500,"坚真花园,海珠,赤岗,距3号线大塘站约740米,赤岗聚德西路利和街",豪华装修,业主直租 海珠赤岗 坚真花园三期 150平米3室2厅2卫
3室2厅2卫,115平米,中层,整租,南北,9000,"保利天悦,海珠,琶洲,距8号线万胜围站约771米,阅江路琶洲塔公园旁",精装修,保利天悦，豪装大三房，家私家电齐全拎包入住，配套成熟随时看房
2室1厅1卫,48平米,中层,整租,南,4800,"万科派,海珠,江燕路,距2号线江泰路站约53米,江泰路站C出口上盖江南大道与江燕路交汇处（燕汇广场正",精装修,江泰路 近地铁 万科派 复式两房 可自住，
2室1厅1卫,75平米,中层,整租,南,3800,"锦绣星城,海珠,东晓南,距2号线东晓南站约442米,东晓南路瑞晓街西一巷",精装修,锦绣星城 电梯精装两房 安静小区 精装修 家电齐全 成熟小区
2室2厅1卫,75平米,中层,整租,南,3800,"海外花园,海珠,昌岗路,距2号线昌岗站约442米,昌岗中路礼岗路5号",精装修,海外花园精装电梯两房，拎包入住
2室2厅1卫,56平米,中层,整租,南,2600,"晓燕湾,海珠,江燕路,距2号线江泰路站约519米,江燕路晓燕街8号",精装修,江燕路 晓燕湾 底层两房 现在业主自己住 家电齐全 近地铁
5室2厅2卫,186平米,低层,整租,南北,13800,"珠江帝景紫龙府,海珠,赤岗,距APM线广州塔站约349米,新港中路艺苑路99号",豪华装修,珠江帝景紫龙府 豪华装修 带平台花园 看房方便
3室2厅2卫,108平米,中层,整租,北,7500,"保利天悦,海珠,琶洲,距8号线万胜围站约771米,阅江路琶洲塔公园旁",豪华装修,保利天悦 北向望江望花园 3房2房 配齐家私 情侣 随时看房
3室2厅1卫,70平米,中层,整租,南,3800,"康隆苑,海珠,江南西,距广佛线沙园站约694米,海珠区江南西328号",简装修,江南西 广百新一城 康隆苑小区管理 低层准电梯 有钥匙随时看房
3室2厅2卫,117平米,低层,整租,东北,7500,"芭堤水岸,海珠,滨江东,距8号线鹭江站约974米,滨江东路环月街2号",精装修,广州大桥底芭堤水岸85方三房东北向 全新住家装修 随时可以看房
3室2厅1卫,83平米,高层,整租,南北,4600,"顺景雅苑,海珠,新港西,距8号线中大站约417米,新港西路立新东街1号",精装修,新港西3室4600元好房出租，舒适，干净整洁，随时入住
2室2厅1卫,70平米,中层,整租,南,2800,"瑞宝花园,海珠,东晓南,距2号线东晓南站约365米,东晓南路1510至1526号",豪华装修,瑞宝花园 租豪华中层步梯两房 家私电齐全 采光好 出入方便
2室1厅1卫,68平米,中层,整租,南,4000,"东恒花园,海珠,赤岗,海珠区石榴岗路",中装修,东恒花园简装大2居环境没的说一个字 好! 装修两个字 更好
2室2厅1卫,70平米,高层,整租,南,3200,"恒洲小苑,海珠,南洲,距2号线南洲站约429米,西滘进贤大街3号",精装修,东晓南 恒洲小苑 南向电梯两房 带一个天台 11.28
2室2厅1卫,91平米,中层,整租,南,6000,"珠江帝景苑,海珠,赤岗,距APM线广州塔站约591米,新港中路艺苑路99号",精装修,珠江帝景 两房急租 近空 交通方便 随时可看房
2室1厅1卫,70平米,高层,整租,东南,1980,"保利红棉花园,海珠,江燕路,距广佛线燕岗站约600米,工业大道中江燕路353号",简装修,江燕路 保利红棉花园 精装两房 望广州塔
2室1厅1卫,60平米,中层,整租,南,3000,"细岗东小区,海珠,昌岗路,距8号线晓港站约376米,细岗路细岗东区",精装修,细岗东小区 昌岗 晓港双地铁 生活便利
2室1厅1卫,76平米,高层,整租,东南,3600,"第三金碧花园,海珠,工业大道南,距2号线东晓南站约990米,工业大道南821号",毛坯,口 金碧花园三期 业主婚房放租 今天实拍 精装温馨两房
4室2厅2卫,107平米,中层,整租,南北,5500,"中山大学蒲园区,海珠,中大,距8号线中大站约386米,新港西路135号",精装修,中大四房全新出租 性价比蕞高的房子 明智之选 家具全齐 拎包即住
2室2厅1卫,72平米,高层,整租,南北,3600,"心江南,海珠,江南大道,距2号线江泰路站约986米,新滘路与江南大道南路交汇处",精装修,心江南 高层电梯精装修两房 视野开阔 采光一流 只要3600元 要快
4室1厅2卫,118平米,中层,整租,南,8000,"蓝色康园,海珠,滨江东,距8号线鹭江站约989米,滨江东路562号",精装修,有匙 精装修温馨4房 只需8000元 随时可看
2室1厅1卫,76平米,低层,整租,东西,3300,"聚德花苑,海珠,赤岗,距3号线大塘站约974米,赤岗大塘聚德路13至15号",简装修,看过你就心动 聚德花苑电梯中层两房 精装修家电齐 随约随看
1室1厅1卫,51平米,低层,整租,南北,3500,"恒鑫东和湾,海珠,滨江东,距8号线鹭江站约808米,滨江东路698号",简装修,"温暖又温心一房一厅, 恒鑫东和湾精装修真的给你不一样的感受"
3室2厅1卫,110平米,高层,整租,南,5800,"琶洲新村,海珠,琶洲,距8号线万胜围站约351米,海珠区新港东路",豪华装修,琶洲新村 三房两厅 装修新净 家私家电齐全 5800月
2室2厅1卫,75平米,中层,整租,南北,5000,"中信乐涛苑,海珠,滨江东,距8号线鹭江站约456米,下渡路12号（近雅蕙街）",精装修,中大北门旁蓝色康园 新装俩房 干净舒适 住家优选 欢迎来电
4室2厅2卫,133平米,中层,整租,南北,8000,"芭堤水岸,海珠,滨江东,距8号线鹭江站约974米,滨江东路环月街2号",豪华装修,滨江怡苑芭堤水岸豪华装修4室 说的再好不如您眼见为实
1室1厅1卫,50平米,中层,整租,南,4300,"琶洲新村,海珠,琶洲,距8号线万胜围站约351米,海珠区新港东路",精装修,琶洲新村电梯一房一厅，家私家电齐，随时入住
3室2厅2卫,263平米,高层,整租,东北,18000,"海珠半岛花园,海珠,滨江东,滨江东路543-549号",精装修,一线江景，高层采光通风都很好，全新家电家私，随时看房
2室2厅1卫,84平米,中层,整租,南北,5200,"琶洲新村,海珠,琶洲,距8号线万胜围站约351米,海珠区新港东路",简装修,琶洲新村，双地铁口 家私家电齐全，拎包入住随时可看房
2室2厅1卫,80平米,高层,整租,南,3700,"保利百合花园,海珠,工业大道南,距广佛线燕岗站约780米,工业大道中381号",精装修,保利百合花园豪华装修2房出租 随时看房 户型方正 拎包入住
1室1厅1卫,30平米,中层,整租,南北,2200,"海城花苑,海珠,滨江东,距6号线东湖站约1141米,滨江东路海印桥旁",豪华装修,急租海城精装一房 家私电齐 拎包即住 有匙即睇只需2200
1室1厅1卫,35平米,高层,整租,东北,2000,"紫龙大街小区,海珠,江南西,距2号线江南西站约253米,江南西路紫龙大街118号",简装修,紫龙大街小区 东北 充满爱的家
2室2厅1卫,80平米,低层,整租,北,6500,"滨江水恋,海珠,广州大道南,距8号线鹭江站约958米,滨江东广州大桥南蕙兰路2至12号",精装修,滨江水恋2室，户型正气，装修干净清爽，价格啊！！！
2室2厅1卫,65平米,中层,整租,南,3500,"康怡苑,海珠,新港西,距8号线鹭江站约803米,海珠区新港西路156号",豪华装修,康怡苑，朝南豪华装修献给懂得享受得你
4室2厅2卫,157平米,高层,整租,南北,12000,"华标涛景湾,海珠,滨江东,距6号线东湖站约934米,海珠区滨江中路466号",豪华装修,华标涛景湾 豪装4室 让您在繁忙的工作中感受到家的温馨
2室1厅1卫,65平米,中层,整租,西南,3000,"赤岗二街1号大院,海珠,赤岗,距8号线赤岗站约1021米,赤岗路赤岗二街1号",精装修,赤岗二街 温馨舒适二房 家电齐全 出行方便 随时看房
4室1厅2卫,161平米,低层,整租,南北,9000,"雅郡花园,海珠,琶洲,距4号线万胜围站约510米,新港东路48号",精装修,雅郡花园 南北通透4室 精装修 带车位出租
2室2厅1卫,70平米,高层,整租,南北,3800,"绿茵翠庭,海珠,赤岗,距8号线客村站约1109米,赤岗路翠庭一街1号",简装修,优选小区 绿茵翠庭 电梯高层两房 拎包入住 有匙即看
2室2厅1卫,76平米,高层,整租,南北,5800,"丽园雅庭,海珠,客村,距8号线客村站约514米,新港中路409号",简装修,丽园雅庭 正规家具家电齐全 温馨方便就是你的选择
2室1厅1卫,86平米,低层,整租,南,3500,"海珠鸿运花园,海珠,客村,距3号线客村站约368米,新港中路368号",精装修,客村出口鸿运花园精装两室环境优美安静舒适家电齐全拎包入
1室1厅1卫,56平米,中层,整租,南,3800,"珠江广场,海珠,滨江东,距8号线鹭江站约805米,滨江东路835号",精装修,珠江广场 精装温馨1房 家私家电齐全 全新装修 随时看房
1室1厅1卫,34平米,高层,整租,南,3200,"双子星城,海珠,新港西,距8号线中大站约742米,新港西路144号",精装修,双子星城 精装南向一房 高层视野开阔 安静舒适 拎包入住
2室1厅1卫,101平米,中层,整租,东北,4000,"海印明珠花园,海珠,东晓南,距8号线晓港站约1092米,东晓路193号",豪华装修,明珠花园豪装两房 家私电器齐 只需4200 有匙即睇
1室1厅1卫,32平米,中层,整租,南,2000,"晓港湾,海珠,南洲,距2号线东晓南站约161米,海珠区东晓南路与侨港路交界处",豪华装修,晓港湾 租花园小区中层步梯一房 家私电齐全 采光好
1室1厅1卫,50平米,中层,整租,南,1800,"聚德花苑,海珠,赤岗,距3号线大塘站约974米,赤岗大塘聚德路13至15号",豪华装修,聚德花园 精装一房 家电齐全 看房方便
3室2厅1卫,85平米,中层,整租,东北,3000,"南洲花苑,海珠,南洲,距2号线南洲站约977米,广州大道南南洲北路",豪华装修, 南州口 南洲花苑 中层三房 精装修家电齐全即住
2室1厅1卫,80平米,中层,整租,南,3000,"电子第七研究所小区,海珠,客村,距3号线客村站约308米,新市头路375号",精装修,电子七所社区 客村 赤岗 精装两房 拎包入住 交通方便
2室1厅1卫,84平米,中层,整租,南,4600,"朗晴居,海珠,滨江中,距2号线市二宫站约455米,滨江中路草芳围2号",简装修,朗晴居二期 欧式豪装 南向 家私家电齐全 拎包入住 随时方便看房
3室2厅2卫,120平米,中层,整租,南北,8000,"珠江帝景苑,海珠,赤岗,距APM线广州塔站约591米,新港中路艺苑路99号",毛坯,广州塔旁 珠江帝景苑3室 现在仅租8000元
2室2厅1卫,84平米,中层,整租,东南,4600,"海珠半岛花园,海珠,滨江东,滨江东路543-549号",豪华装修,海珠半岛花园 高层 东南两房 全新豪华装修 即租即住
2室1厅1卫,60平米,中层,整租,南,3300,"森语星园,海珠,广州大道南,海珠区广州大道南森语一街6号至12号",精装修,森语星园 电梯两房 家电齐全 装修保养好 通风采光好 随时看房
2室1厅1卫,40平米,高层,整租,南,4000,"悦安花园,海珠,东晓南,距8号线晓港站约735米,晓港中马路162号",豪华装修,江泰地铁 4楼 地段优美
2室1厅1卫,60平米,低层,整租,南北,4500,"蓝色康园,海珠,滨江东,距8号线鹭江站约989米,滨江东路562号",精装修,蓝色康园 大型小区 温馨两房 全新家电 给你一个家的感觉
3室2厅2卫,105平米,低层,整租,北,9500,"保利天悦,海珠,琶洲,距8号线万胜围站约771米,阅江路琶洲塔公园旁",豪华装修,保利天悦三房宜家北欧风格家私齐全，照片实拍，拎包入住
3室2厅2卫,114平米,高层,整租,西北,7600,"保利天悦,海珠,琶洲,距8号线万胜围站约771米,阅江路琶洲塔公园旁",精装修,保利天悦，豪华装修家私家电，拎包入住，有随时看
3室2厅2卫,135平米,中层,整租,南,7500,"芭堤水岸,海珠,滨江东,距8号线鹭江站约974米,滨江东路环月街2号",精装修,芭堤水岸 3+1户型 家电齐全
1室0厅1卫,25平米,低层,整租,南,1200,"赤岗西路大院,海珠,赤岗,距8号线客村站约781米,海珠区赤岗西路",中装修,赤岗西路 低层温馨单间 基本设施齐全 仅租1200月 手快有手慢没
3室2厅1卫,126平米,中层,整租,南,5200,"坚真花园,海珠,赤岗,距3号线大塘站约740米,赤岗聚德西路利和街",简装修,坚真花园 南向精装三房 保养好配套齐全 近
3室2厅2卫,205平米,高层,整租,南北,8800,"中信君庭,海珠,滨江东,距8号线鹭江站约971米,滨江东路下渡路49号",豪华装修,百闻不如一见！南北通透3室中信君庭献给懂得享受得你
1室1厅1卫,45平米,高层,整租,南,2500,"益丰花园,海珠,前进路,距2号线市二宫站约135米,江南大道北前进路",精装修,市二宫 精装修 一房一厅 看房方便 拎包入住
2室1厅1卫,68平米,中层,整租,北,3300,"鸿新苑,海珠,滨江东,距8号线鹭江站约430米,海珠区雅蕙街大江冲27号",中装修,鸿新苑 家私家电齐 干净舒适漂亮 屋子通风采光好
1室1厅1卫,45平米,高层,整租,南,2500,"南珠广场,海珠,江燕路,距2号线江泰路站约244米,江燕路111号",简装修,江燕路 南珠广场 晓燕湾 电梯一房 全明屋 位置安静 近地铁
2室2厅1卫,78平米,高层,整租,东北,4200,"海琴湾,海珠,滨江东,距8号线鹭江站约886米,滨江东路511号",豪华装修,底价出租豪华装修2室采光好拎包随时就可以入住
4室2厅3卫,235平米,中层,整租,南北,12000,"中信君庭,海珠,滨江东,距8号线鹭江站约971米,滨江东路下渡路49号",豪华装修,中信君庭 君临天下 360度江景 豪华装修 南北对流 拎包入住
3室2厅1卫,120平米,中层,整租,南,4800,"汇美南苑,海珠,广州大道南,距3号线客村站约775米,广州大道南新领事馆旁",精装修,广州塔 汇美南苑 电梯精装三房 家电齐全 房子干净 保养很好
4室2厅2卫,187平米,高层,整租,南北,14000,"珠江帝景紫龙府,海珠,赤岗,距APM线广州塔站约349米,新港中路艺苑路99号",豪华装修,珠江帝景紫龙府 187平4室 充满爱的家
3室2厅1卫,89平米,低层,整租,南,4200,"滨江瑞城,海珠,南洲,距2号线东晓南站约357米,东晓南路宝成街6-10号（双号）",精装修,滨江瑞城 高大上小区 厅出阳台 温馨舒适2+1户型 家私齐 业主急租
2室1厅1卫,80平米,低层,整租,南,4500,"润汇大厦,海珠,江南西,距2号线江南西站约536米,江南西路60至72号",简装修,润汇大厦2室采光好交通便利配套完善
3室2厅1卫,80平米,中层,整租,南,3900,"保利红棉花园,海珠,江燕路,距广佛线燕岗站约600米,工业大道中江燕路353号",中装修,江燕路 保利红棉花园 三房两厅 保养新净 家具家电齐
2室1厅1卫,59平米,中层,整租,南,4200,"晓港雅筑,海珠,昌岗路,距8号线晓港站约80米,海珠区昌岗东路268至272号双号",简装修,晓港雅筑复式2房 家私家电齐 拎包即住 4200元
2室2厅1卫,75平米,低层,整租,南,2600,"万翠苑,海珠,南洲,距2号线东晓南站约383米,侨港路51号",简装修,万翠苑 低层两房 住家 家电齐只租2600/月
2室1厅1卫,69平米,中层,整租,南,5500,"城启天鹅湾,海珠,工业大道北,距广佛线沙园站约695米,革新路天鹅街1至13号",简装修,江景大两房 舒适宁静的住宅区
2室1厅1卫,48平米,中层,整租,北,4500,"万科派,海珠,江燕路,距2号线江泰路站约53米,江泰路站C出口上盖江南大道与江燕路交汇处（燕汇广场正",精装修,万科派精装复式两房，可
1室1厅1卫,44平米,高层,整租,东,2200,"海富花园,海珠,江燕路,距2号线江泰路站约420米,江南大道南江燕路20号",精装修,海富花园 精装修 一房一厅 年轻化装修 仅租2200元
5室2厅3卫,256平米,高层,整租,南,9000,"逸景翠园,海珠,广州大道南,距3号线大塘站约1081米,广州大道南1028号",豪华装修,逸景翠园 南向腹式五房 大平台 随时可以入住 业主自住
3室2厅1卫,95平米,中层,整租,北,6800,"江南新苑,海珠,中大,距8号线晓港站约573米,海珠区新港西路66号",豪华装修,江南新苑三期，豪华装修，说的再好不如您眼见为实
1室1厅1卫,45平米,低层,整租,东南,2500,"天海庭,海珠,江燕路,距2号线江泰路站约546米,海珠区江燕路燕子岗88号",精装修,江燕路 天海庭 电梯高层 新装修 家电齐全 近地铁
2室1厅1卫,75平米,中层,整租,南,3000,"同福东路小区,海珠,江南大道,距2号线市二宫站约182米,同福东路621号",精装修,同福路 南向精装修2房2厅 家私电齐全 交通方便 拎包入住
2室1厅2卫,80平米,高层,整租,北,4800,"海珠半岛花园,海珠,滨江东,滨江东路543-549号",精装修,海珠半岛花园 精装修2室 一线望江放租。
1室1厅1卫,45平米,高层,整租,南北,2200,"东晓花苑,海珠,东晓南,距8号线中大站约1091米,海印桥南海联路138号至148号双号",豪华装修,东晓花苑 豪装一房 家私电器齐 仅需1800 有匙即睇
1室1厅1卫,52平米,中层,整租,南北,4000,"珠江新岸公寓,海珠,滨江东,距APM线广州塔站约975米,滨江东路玉涵路28号",精装修,珠江新岸 品牌物业 温馨舒适 南北通透 家电齐全
