apartment,area,floor,lease_mode,orientation,price,quarters,renovation,title
3室1厅1卫,97平米,中层,整租,东北,4600,"第一金碧花园,海珠,工业大道南,距2号线东晓南站约845米,工业大道南821号",精装修,石溪东晓南双地铁金碧花园都市广场新精装三房仅租4600
2室2厅1卫,70平米,高层,整租,南,3800,"海珠鸿运花园,海珠,客村,距3号线客村站约368米,新港中路368号",精装修,客村，鸿运花园，小区管理，电梯高层两房
2室1厅1卫,78平米,中层,整租,南,2500,"基立下道大院,海珠,滨江中,距2号线市二宫站约589米,仲恺路基立下道北街",精装修,全明屋，大两房带阳台，拎包入住
2室2厅1卫,78平米,低层,整租,南,4300,"海珠鸿运花园,海珠,客村,距3号线客村站约368米,新港中路368号",精装修,鸿运花园 电梯两房 高层望花园双阳台 家电齐全 有钥匙
3室1厅1卫,87平米,低层,整租,东南,6200,"芭堤水岸,海珠,滨江东,距8号线鹭江站约974米,滨江东路环月街2号",精装修,芭堤水岸 全新精装舒适三房 东南向中楼层 家电齐拎包入住
3室2厅2卫,133平米,中层,整租,东南,5000,"星辉豪庭,海珠,江南大道,距2号线昌岗站约217米,海珠区江南大道南368号",毛坯,星辉豪庭 3室5000元  炫目登场
2室2厅1卫,70平米,低层,整租,西南,4200,"富泽园,海珠,工业大道北,距8号线凤凰新村站约513米,革新路116号",简装修,富泽园 小区管理 家私电器全齐 户形方正
2室1厅1卫,65平米,中层,整租,南,3000,"聚德花苑,海珠,赤岗,距3号线大塘站约974米,赤岗大塘聚德路13至15号",简装修,大塘聚德花苑 低层精装二房 家电齐全 温馨舒适 随时可入住
1室1厅1卫,42平米,高层,整租,东南,2800,"鹭苑公寓,海珠,新港西,距8号线鹭江站约153米,新港西下渡路76号",精装修,"家具家电全齐,2800元/月,拎包即住"
3室2厅2卫,117平米,中层,整租,东南,5800,"富力千禧花园三期,海珠,新港西,距8号线晓港站约477米,新港西千禧三街",精装修,富力千禧花园·三期·高层精装修·随时看房
2室2厅1卫,87平米,高层,整租,东北,6900,"滨江水恋,海珠,广州大道南,距8号线鹭江站约958米,滨江东广州大桥南蕙兰路2至12号",豪华装修,动动你的手 不用满城跑 滨江水恋有你满意的爱巢 看房方便
2室1厅1卫,68平米,中层,整租,东北,3000,"赤岗东路97号大院,海珠,赤岗,距8号线客村站约955米,赤岗东路97号",精装修,赤岗89号大院 大两房 家电齐全 大院管理 公交沿线！
1室1厅1卫,40平米,中层,整租,东南,2000,"聚宝阁,海珠,赤岗,距8号线赤岗站约1068米,赤岗东与碧映路交接处",中装修,赤岗聚宝阁 好楼层 南向一房一厅 也算假两房一厅 随时可入住
2室2厅1卫,60平米,高层,整租,南,2300,"瑞宝花园,海珠,东晓南,距2号线东晓南站约365米,东晓南路1510至1526号",简装修,瑞宝花园 步梯中层 厅出阳台 实用俩房 仅租2300元 拎包入住
2室1厅1卫,92平米,高层,整租,南,5500,"富力银禧花园,海珠,滨江东,距8号线中大站约977米,海珠区滨江东路怡趣街",简装修,富力银禧花园 大2房92方租5500元 豪华装修
3室1厅2卫,130平米,高层,整租,南北,6000,"天立俊园,海珠,滨江东,距APM线广州塔站约1048米,滨江东路1008号",精装修,天立俊园 精装三房 时尚装修 拎包入住 随时看房
3室2厅1卫,130平米,高层,整租,南,7500,"丽影华庭,海珠,客村,距8号线客村站约122米,新港中路354号",精装修,丽影华庭 电梯高层 精装三房仅租7500元 随时看房
3室2厅1卫,108平米,高层,整租,北,8500,"保利天悦,海珠,琶洲,距8号线万胜围站约771米,阅江路琶洲塔公园旁",豪华装修,保利天悦 高层望江 舒适高层三房，家私家电齐全 随时可以看房
4室2厅2卫,140平米,中层,整租,东南,6800,"金穗东苑,海珠,广州大道南,距3号线大塘站约889米,广州大道南新敦路52至66号",精装修,金穗东苑 豪华装修 中高层 精装修 业主自住！！！
2室2厅1卫,73平米,高层,整租,南,2700,"保利红棉花园,海珠,江燕路,距广佛线燕岗站约600米,工业大道中江燕路353号",精装修,保利红棉花园，环境优美，交通便利，地段繁华
3室2厅2卫,125平米,高层,整租,东南,4500,"嘉汇华庭居尚,海珠,前进路,距2号线江南西站约554米,前进路79至87号",豪华装修,环境舒适 视线开阔 生活便利 小区管理
3室2厅1卫,100平米,中层,整租,南,4800,"南洲名苑,海珠,南洲,距2号线南洲站约413米,南洲路13号（近东晓南路）",豪华装修,南洲名苑 租豪华电梯三房 家私电齐全 采光好 阳台望花园
1室1厅1卫,45平米,中层,整租,南,2500,"中山大学蒲园区,海珠,中大,距8号线中大站约386米,新港西路135号",精装修,中大·低层一房一厅·家电新净·随时看房·诚心出租
3室1厅1卫,120平米,高层,整租,南,4200,"高教花园,海珠,赤岗,距8号线磨碟沙站约429米,新港东路与黄埔冲交汇处",精装修,高教花园 精装电梯三房 拎包入住 配套齐全 看房方便
3室2厅2卫,176平米,中层,整租,东南,10000,"中信君庭,海珠,滨江东,距8号线鹭江站约971米,滨江东路下渡路49号",豪华装修,中信君庭豪华装修 景观优美视野开阔 生活 舒适安静
3室2厅1卫,92平米,中层,整租,南,4500,"兰亭熙园,海珠,昌岗路,距8号线宝岗大道站约369米,昌岗中路164号",精装修,昌岗地铁 兰亭熙园 精装三房 家电齐全 园林小区
4室2厅3卫,172平米,低层,整租,东南,7800,"珠江帝景华苑,海珠,赤岗,距APM线广州塔站约435米,新港中路艺苑路289号",豪华装修,帝景华苑 豪华装修 让您在繁忙的工作中感受到家的温馨
2室1厅1卫,66平米,中层,整租,南,3000,"毛纺小区,海珠,赤岗,距8号线赤岗站约568米,新港中赤岗东路",精装修,赤岗地铁沿线 毛纺小区 温馨舒适二房一厅 位置安静方便
1室1厅1卫,45平米,中层,整租,南北,2450,"鸿新苑,海珠,滨江东,距8号线鹭江站约430米,海珠区雅蕙街大江冲27号",简装修,鹭江 鸿新苑 一房一厅 低楼层 随时看房 有钥匙
3室2厅2卫,110平米,低层,整租,南北,5500,"海琴湾,海珠,滨江东,距8号线鹭江站约886米,滨江东路511号",简装修,装修清新，海琴湾3室，关键是房东人也很好，有钥匙看房
1室1厅1卫,30平米,中层,整租,南,1300,"滨江中路小区,海珠,滨江中,距6号线团一大广场站约1019米,海珠滨江中路地段",精装修,滨江中路 低层单间 只需1300元 装修保养新净
5室2厅2卫,202平米,中层,整租,南,12000,"珠江帝景苑,海珠,赤岗,距APM线广州塔站约591米,新港中路艺苑路99号",精装修,珠江帝景 高层视野好克莱金殿南向双主套 实景拍摄 装修保养好
3室2厅2卫,110平米,中层,整租,东南,5500,"泊雅湾,海珠,赤岗,距APM线广州塔站约650米,海珠区赤岗艺洲路泊雅湾地铁赤岗塔站",豪华装修,广州塔附近 泊雅湾 东南向电梯3房 装修超靓 高层望花园
2室1厅1卫,50平米,中层,整租,北,4500,"万科派,海珠,江燕路,距2号线江泰路站约53米,江泰路站C出口上盖江南大道与江燕路交汇处（燕汇广场正",精装修,万科派 什么房什么价 好房又低价 辛苦找房不就是为它吗
4室2厅2卫,159平米,低层,整租,南北,6200,"罗马家园,海珠,沥滘,距3号线沥滘站约798米,海珠区南洲路88号",豪华装修,罗马家园159平方豪华装修4房 全新家电一线望江
2室1厅1卫,78平米,中层,整租,南,5500,"江南新苑,海珠,中大,距8号线晓港站约573米,海珠区新港西路66号",豪华装修,江南新苑 精装两房 格局方正 豪华装修 家私电器齐全
3室2厅1卫,108平米,高层,整租,东南,5500,"东翠花园,海珠,滨江中,距8号线中大站约1153米,海珠区海联路东翠南街2-30号",精装修,滨江 东翠花园 高层三房 光线通风好 精装修
1室1厅1卫,45平米,高层,整租,南,2600,"柏涛雅苑,海珠,昌岗路,距2号线昌岗站约517米,昌岗中路礼岗路6号",简装修,柏涛雅苑 电梯一房一厅 精装修 仅租2600元
2室2厅1卫,93平米,中层,整租,南,5500,"泊雅湾,海珠,赤岗,距APM线广州塔站约650米,海珠区赤岗艺洲路泊雅湾地铁赤岗塔站",豪华装修,地铁 全新两房未住 家私电器 求好客户入住
3室2厅2卫,115平米,低层,整租,北,4500,"第三金碧花园,海珠,工业大道南,距2号线东晓南站约990米,工业大道南821号",精装修,本人实拍 东晓南 工业大道南金碧花园三期 精装大三房 家电齐
3室2厅1卫,105平米,低层,整租,东南,7500,"富力金禧花园,海珠,宝岗,距6号线一德路站约816米,南华中路221号",精装修,富力金禧花园三房两厅入户花园家电齐全豪华装修阳台
1室1厅1卫,45平米,中层,整租,南,2200,"聚德花苑,海珠,赤岗,距3号线大塘站约974米,赤岗大塘聚德路13至15号",简装修,聚德花苑 大塘地鉄 精装一房一厅 家电齐全 拎包入住 交通便捷
3室2厅2卫,132平米,高层,整租,东南,6000,"珠江广场水岸卫城,海珠,滨江东,距8号线鹭江站约948米,滨江东路835号",精装修,珠江广场四期大三房仅6000大型临江小区 安静对流
3室2厅2卫,103平米,中层,整租,东南,4000,"保利花园,海珠,工业大道南,距广佛线燕岗站约635米,工业大道中400号",精装修,本人实拍 工业大道中保利花园 精装电梯三房带主套 家电齐即看
2室1厅1卫,75平米,中层,整租,东南,5000,"中海联同福睿府,海珠,江南大道,距2号线市二宫站约302米,同福东路608号",中装修,市二宫地铁站300米，精装修两房一厅
2室1厅1卫,75平米,中层,整租,南北,3600,"南珠广场,海珠,江燕路,距2号线江泰路站约244米,江燕路111号",精装修,江燕路 南珠广场 75方电梯大两房 住家装修 近地铁
1室1厅1卫,47平米,高层,整租,北,2400,"赤岗丽景花园,海珠,赤岗,距8号线磨碟沙站约443米,新港东路38号至72号",精装修,磨碟沙 丽景花园 带阳台一房一厅 近磨碟沙地铁 拎包入住！
1室1厅1卫,42平米,中层,整租,南,2700,"宝通街大院,海珠,东晓南,距2号线东晓南站约459米,海珠区东晓宝通街",精装修,侨诚花园 电梯精装一房 家电齐业主急租2700/月
3室2厅1卫,110平米,中层,整租,南北,5500,"影城花园,海珠,客村,距8号线客村站约237米,新港中路350号",精装修,客村口 影城花园 电梯三房 配置齐全 业主同意租
3室2厅2卫,110平米,中层,整租,东南,6200,"琶洲新村,海珠,琶洲,距8号线万胜围站约351米,海珠区新港东路",精装修,琶洲新村 3房租6200 交通便利 保利物业 业主诚意出租
1室1厅1卫,40平米,低层,整租,南,2300,"侨诚花园,海珠,南洲,距2号线东晓南站约374米,工业大道南253号",精装修,侨诚花园 电梯带平台花园 精装实用一房 家私电齐 仅租2300元
1室1厅1卫,53平米,中层,整租,南,3300,"滨江瑞城,海珠,南洲,距2号线东晓南站约357米,东晓南路宝成街6-10号（双号）",豪华装修,滨江瑞成 租豪华电梯一房 家私电齐全 采光好 出入方便
3室1厅1卫,80平米,中层,整租,南,4400,"翠城花园六期,海珠,昌岗路,距8号线宝岗大道站约269米,昌岗路与宝岗大道交汇处",精装修,翠城花园 精装两房 中层望花园 领包入住 看房提前约
2室1厅1卫,80平米,高层,整租,南,4600,"富基广场,海珠,江南大道,距2号线市二宫站约166米,江南大道北小港路163号",精装修,市二宫 富基广场 高层精装两房 南向望花园 安静舒适 宜
2室2厅1卫,65平米,高层,整租,南,3800,"新城国际寓,海珠,工业大道南,距2号线东晓南站约791米,江南大道南与工业大道南交汇（第一金碧旁）",精装修,东晓南石溪地鉄口 新城国际寓 两房次新房 家电齐全
3室2厅2卫,117平米,高层,整租,南,4800,"金穗雅园,海珠,广州大道南,距3号线大塘站约1033米,海珠区广州大道南933号",豪华装修,金穗雅苑 三房南向花园中间 住家超舒适 家电全新 拎包入住
3室2厅2卫,114平米,中层,整租,南,6800,"珠江广场,海珠,滨江东,距8号线鹭江站约805米,滨江东路835号",精装修,珠江广场 精装大3房 家私家电齐全 南北对流 随时看房 随时看房
2室1厅1卫,75平米,中层,整租,南,2500,"海富花园,海珠,江燕路,距2号线江泰路站约420米,江南大道南江燕路20号",精装修,江燕路 海富花园 精装2居室 家电全齐 位置安静
2室1厅1卫,72平米,高层,整租,东,3500,"金沙花园,海珠,工业大道北,距8号线凤凰新村站约409米,工业大道北革新路125号",精装修,超级，金沙花园全新精装修2室，舒适的享受
2室2厅1卫,68平米,高层,整租,南,2800,"南洲名苑,海珠,南洲,距2号线南洲站约413米,南洲路13号（近东晓南路）",精装修,南洲名苑 小区安静电梯两房 家电齐只租2800/月
4室2厅3卫,166平米,高层,整租,南,8000,"逸景翠园,海珠,广州大道南,距3号线大塘站约1081米,广州大道南1028号",精装修,逸景翠园 花园中间 大户型四房 精装修 双阳台 南北通透
4室2厅2卫,175平米,中层,整租,南北,10000,"中信君庭,海珠,滨江东,距8号线鹭江站约971米,滨江东路下渡路49号",豪华装修,中信君庭 滨江东江景花园小区 南北对流 南北双阳台 全江景视野
2室2厅1卫,93平米,高层,整租,南,5200,"珠江帝景苑,海珠,赤岗,距APM线广州塔站约591米,新港中路艺苑路99号",豪华装修,珠江帝景 南向 温馨装修 保养新净 近
1室1厅1卫,56平米,高层,整租,南北,3600,"蓝色康园,海珠,滨江东,距8号线鹭江站约989米,滨江东路562号",精装修,蓝色康园靓装修56方3600元/月
3室2厅2卫,115平米,高层,整租,南,6200,"琶洲新村,海珠,琶洲,距8号线万胜围站约351米,海珠区新港东路",精装修,琶洲 3房2厅带主套 南向高层 欧式家私 安静看小区花园 租6200
1室1厅1卫,45平米,低层,整租,南北,2000,"昌岗小区,海珠,昌岗路,距8号线宝岗大道站约216米,昌岗中路146至152号",精装修,昌岗小区宝岗大道地铁口两房一厅，随时看房
3室2厅2卫,110平米,中层,整租,东北,5500,"柏涛雅苑,海珠,昌岗路,距2号线昌岗站约517米,昌岗中路礼岗路6号",精装修,柏涛雅苑精装三房两厅带主套，双阳台
2室2厅1卫,87平米,低层,整租,南,5300,"利海假日轩,海珠,赤岗,距8号线赤岗站约894米,赤岗东路赤岗中学对面",简装修,利海假日轩 简装 出租 四部空调 随时看房
2室2厅1卫,85平米,高层,整租,南,3800,"罗马家园,海珠,沥滘,距3号线沥滘站约798米,海珠区南洲路88号",精装修,罗马家园 南向 两房两厅 家具齐全 随时可以看房
3室2厅2卫,110平米,低层,整租,西南,6200,"琶洲新村,海珠,琶洲,距8号线万胜围站约351米,海珠区新港东路",精装修,琶洲新村 精装修大3房 家私齐全拎包即住 采光好 交通方便
2室1厅1卫,55平米,中层,整租,南,2500,"江南西玫瑰园,海珠,江南西,距2号线江南西站约462米,江南西路青竹大街23号",精装修,江南西小区玫瑰园，电梯两房，豪华装修，拎包入住
2室1厅1卫,98平米,低层,整租,南,5000,"元邦明月园,海珠,赤岗,距8号线赤岗站约755米,赤岗东路231号",简装修,元邦明月园 赤岗地鉄 电梯豪华装修 两室一厅 拎包入住 交通便利
2室2厅1卫,77平米,低层,整租,南北,5000,"丽影华庭,海珠,客村,距8号线客村站约122米,新港中路354号",简装修,丽影华庭 客村双 繁华地段 交通便利 家可
5室2厅4卫,303平米,低层,整租,南北,30000,"金海湾,海珠,滨江东,距8号线鹭江站约1152米,滨江东路555号",豪华装修,金海湾 全国十大豪宅 名贵豪华家私家电 全江景带空中花园 拎包住
2室2厅1卫,91平米,中层,整租,南北,5200,"琶洲新村,海珠,琶洲,距8号线万胜围站约351米,海珠区新港东路",精装修,琶洲新村，家私电器齐全拎包入住，全新装修大两房，随时方便看房
3室2厅2卫,136平米,高层,整租,南,9500,"高雅湾,海珠,滨江东,滨江东路318号、怡福路247路、文晖街1号-5号（",豪华装修,高雅湾 中大旁全新装修未住 南向三房 业主诚意出租
1室0厅1卫,28平米,高层,整租,南,1500,"南田路小区,海珠,宝岗,距8号线凤凰新村站约410米,南田路120号附近",简装修,南田路 方便看楼 家私齐全 采光靚 通风好 大阳台
1室1厅1卫,40平米,低层,整租,北,3500,"蓝色康园,海珠,滨江东,距8号线鹭江站约989米,滨江东路562号",简装修,有家有爱有温馨！蓝色康园温馨1室！让您享受生活
3室2厅2卫,110平米,中层,整租,西北,6000,"丽景湾,海珠,滨江东,距8号线鹭江站约967米,滨江东路907号",精装修,丽景湾 南北对流一线望江 安静舒适 家电齐全 头一次放租
3室2厅2卫,110平米,低层,整租,南北,5500,"新鸿花园,海珠,赤岗,距APM线广州塔站约615米,艺洲路与江丽路交汇处",豪华装修,！新鸿花园3室南北通透家具电器齐全干净
2室1厅1卫,74平米,中层,整租,北,4500,"逸景翠园,海珠,广州大道南,距3号线大塘站约1081米,广州大道南1028号",精装修,逸景翠园 温馨两房 家电齐全 安静舒适 拎包入住
3室2厅2卫,125平米,高层,整租,南,7800,"保利天悦,海珠,琶洲,距8号线万胜围站约771米,阅江路琶洲塔公园旁",简装修,保利天悦 三房两厅 配齐家私 北向望江 随时看房 价格可以谈
3室2厅2卫,103平米,高层,整租,南北,4800,"保利百合花园,海珠,工业大道南,距广佛线燕岗站约780米,工业大道中381号",豪华装修,保利百合花园 高楼层 豪装 拎包入住 随时看房 采光好
1室0厅1卫,37平米,高层,整租,北,3700,"珠光高派,海珠,滨江东,距8号线鹭江站约851米,滨江东路586号",豪华装修,滨江东 8号线珠光高派华庭 豪华装修 图片 拎包即住
2室2厅1卫,92平米,中层,整租,东西,4700,"雅郡花园,海珠,琶洲,距4号线万胜围站约510米,新港东路48号",精装修,雅郡熙源 大两房 吉屋出租 望园景 手快有慢无
1室1厅1卫,45平米,中层,整租,南北,3000,"蓝色快线,海珠,江南大道,距1号线陈家祠站约333米,江南大道北69号",精装修,蓝色快线 干净明亮 家私电器齐全 温馨舒适 市二宫沿线
2室1厅1卫,60平米,高层,整租,南,4000,"蓝色康园二期,海珠,滨江东,距8号线鹭江站约1004米,滨江东路562号",精装修,蓝色康园精装两房，有效期7天，赶紧来电
1室0厅1卫,50平米,中层,整租,南,3400,"合生广场,海珠,广州大道南,距3号线大塘站约1113米,广州大道南与叠景路交汇处（区政府对面）",豪华装修,合生广场 广州大道南 网红 吃喝玩乐下楼就有 随时看房
1室0厅1卫,30平米,中层,整租,南,1600,"广发新村,海珠,赤岗,距8号线赤岗站约472米,新港中路489号",中装修,广发新村 地铁沿线 低层温馨大单间 家电齐全 仅租1600月
5室2厅1卫,145平米,中层,整租,南,6800,"荟贤大厦,海珠,宝岗,距8号线凤凰新村站约947米,同福中路328号",精装修,精修大房屋 追求高品质的生活 业主诚心低价出租 方正实用
2室1厅1卫,68平米,中层,整租,南,4500,"赤岗丽景花园,海珠,赤岗,距8号线磨碟沙站约443米,新港东路38号至72号",中装修,磨碟沙地鉄 花园小区 精装修 正规两房 超强采光 送家电
3室1厅1卫,88平米,中层,整租,北,4500,"宏宇广场,海珠,宝岗,距2号线市二宫站约918米,宝岗大道10号至12号",精装修,好房 绝度 好房不是天天有 稍纵即逝 抓紧时间哦
2室1厅1卫,60平米,中层,整租,南,4500,"珠影大院,海珠,客村,距3号线客村站约195米,新港中路354号",简装修,珠影大院 精装修两房 视野开阔 拎包入住
2室1厅1卫,60平米,中层,整租,北,2300,"保利红棉花园,海珠,江燕路,距广佛线燕岗站约600米,工业大道中江燕路353号",精装修,"保利红棉花园精装2居室,路过别错过源"
3室2厅2卫,112平米,中层,整租,南,5800,"中海名都,海珠,滨江中,距2号线市二宫站约808米,滨江中纺织路1号",精装修,中海名都·精装大三房·户型方正实用·家私家电齐全·东向望江
2室2厅1卫,70平米,中层,整租,北,4500,"蓝色康园,海珠,滨江东,距8号线鹭江站约989米,滨江东路562号",豪华装修,又优惠！诚心出租朝北 2室，物有所值，不要错过哟
2室1厅1卫,65平米,高层,整租,南,4700,"金碧湾,海珠,工业大道北,距8号线凤凰新村站约649米,革新路105号",简装修,金碧湾 江景两房 靓爆镜 新净 舒适
3室2厅2卫,110平米,高层,整租,南,6500,"琶洲新村,海珠,琶洲,距8号线万胜围站约351米,海珠区新港东路",精装修,琶洲新村 南向3房 房大厅大 干净整洁 诚心出租 随时看房 价可谈
2室1厅1卫,70平米,中层,整租,南,3100,"金碧花园,海珠,工业大道南,距2号线东晓南站约845米,工业大道南821号",精装修,口 金碧花园 租客工作原因转租 精装两房 租3100元
2室1厅1卫,80平米,中层,整租,南北,3500,"万寿雅苑,海珠,滨江中,距2号线江南西站约851米,万寿北路48号",精装修,房东自住型装修，照片，实地拍摄，干净清爽，随时来电看房！
3室2厅1卫,82平米,中层,整租,南,3500,"江南西小区,海珠,江南西,距2号线江南西站约202米,江南西路",简装修,江南西小区 正规三房 家私家电齐全 采光一流 看房方便
1室1厅1卫,47平米,中层,整租,南,3400,"合生广场,海珠,广州大道南,距3号线大塘站约1113米,广州大道南与叠景路交汇处（区政府对面）",豪华装修,合生广场欧式豪华装修一房，高层南向通风采光好，拎包入住
2室1厅1卫,70平米,中层,整租,南,2700,"晓燕湾,海珠,江燕路,距2号线江泰路站约519米,江燕路晓燕街8号",精装修,江燕路，晓燕湾，精装修两房，交通便利，拎包入住，通风采光好
2室2厅1卫,60平米,中层,整租,南,3000,"侨诚花园,海珠,南洲,距2号线东晓南站约374米,工业大道南253号",精装修,地铁口侨诚花园 电梯两房精装温馨舒适 家电齐全
5室2厅3卫,200平米,低层,整租,东南,12000,"珠江帝景苑克莱国际公寓,海珠,客村,距APM线广州塔站约519米,新港中路艺苑99号",简装修,广州塔附近珠江帝景200方中层五房双主套，住家都可以有钥匙
4室2厅2卫,149平米,高层,整租,东北,10000,"珠江帝景苑,海珠,赤岗,距APM线广州塔站约591米,新港中路艺苑路99号",豪华装修,珠江帝景克莱四房 保养好家私新 出行便利 业主次放租
3室2厅2卫,134平米,中层,整租,东南,9000,"佳信花园,海珠,赤岗,距8号线赤岗站约611米,新港中路489号",豪华装修,佳信花园 三房 亲自拍的 家电齐全 高层通风 随时看
1室1厅1卫,40平米,中层,整租,南北,2200,"海城花苑,海珠,滨江东,距6号线东湖站约1141米,滨江东路海印桥旁",精装修,海城花苑 精致一房一厅 仅租2200元 家电齐全 有匙即看
2室1厅1卫,82平米,中层,整租,北,4000,"泓景花园,海珠,赤岗,距8号线赤岗站约788米,赤岗北路18号",精装修,泓景花园，精装修大两房，可望广州塔
2室1厅1卫,74平米,中层,整租,南北,3280,"江南西小区,海珠,江南西,距2号线江南西站约202米,江南西路",精装修,江南西 精装正规两房 南北通透 保养新 交通便利 看房约
2室2厅1卫,91平米,低层,整租,南,5000,"珠江帝景苑,海珠,赤岗,距APM线广州塔站约591米,新港中路艺苑路99号",豪华装修,珠江帝景 南向大两房 业主自住放租 家具保养漂亮 随时看
5室2厅2卫,204平米,高层,整租,南北,12000,"华标涛景湾,海珠,滨江东,距6号线东湖站约934米,海珠区滨江中路466号",豪华装修,华标涛景湾 高层一线江景 保养温馨 家电全齐 12000元
2室2厅1卫,70平米,中层,整租,东南,3000,"南洲花苑,海珠,南洲,距2号线南洲站约977米,广州大道南南洲北路",精装修,南洲花苑四期 精致中层安静两房 户型方正 家电齐全 采光好 便宜
3室2厅2卫,108平米,低层,整租,东南,6000,"琶洲新村,海珠,琶洲,距8号线万胜围站约351米,海珠区新港东路",精装修,琶洲新村 精装温馨3房 业主自住看房方便 家电齐全拎包入住
2室1厅1卫,75平米,高层,整租,南北,4000,"蓝色康园,海珠,滨江东,距8号线鹭江站约989米,滨江东路562号",豪华装修,让梦飞起来 梦中的房子就在这 蓝色康园
1室1厅1卫,45平米,低层,整租,南,3900,"合生广场,海珠,广州大道南,距3号线大塘站约1113米,广州大道南与叠景路交汇处（区政府对面）",精装修,合生广场 精装一房 生活便利 白领精英聚集地
4室2厅3卫,240平米,中层,整租,南,20000,"珠江广场水岸卫城,海珠,滨江东,距8号线鹭江站约948米,滨江东路835号",精装修,水岸卫城 本人不做虚拟房源 全新诚真盘源 不浪费大家时间
1室1厅1卫,55平米,高层,整租,南北,3500,"影城花园,海珠,客村,距8号线客村站约237米,新港中路350号",豪华装修,影城花园 电梯一房出租 看房方便  可登记
5室2厅1卫,120平米,中层,整租,南,4800,"怡雅苑,海珠,宝岗,距8号线凤凰新村站约592米,宝岗大道马涌直街82号",精装修,怡雅苑实用大四房 厅大房大 光线充足 通风对流
