apartment,area,floor,lease_mode,orientation,price,quarters,renovation,title
2室1厅1卫,50平米,高层,整租,南,2300,"远安新街小区,海珠,滨江中,距6号线东湖站约1084米,海珠区远安新街",精装修,有钥匙 远安新街 经济实惠两房 不错 随时可以看 2300元 6楼
2室1厅1卫,70平米,高层,整租,南,3800,"信步闲庭,海珠,赤岗,距8号线赤岗站约814米,赤岗石榴岗路信步中街",精装修,信步闲庭 2居精装 环境好 时尚温馨 家电齐全 随时可入住
1室1厅1卫,40平米,中层,整租,东南,2300,"赤岗东小区,海珠,赤岗,距8号线赤岗站约728米,海珠区赤岗东路赤岗一街12-7号",简装修,此单位户型方正实用，1房1厅，动静分离，安静舒适
3室2厅2卫,110平米,中层,整租,西北,7000,"泓景花园,海珠,赤岗,距8号线赤岗站约788米,赤岗北路18号",精装修,赤岗 泓景花园 精装大三房 拎包入住
1室1厅1卫,27平米,中层,整租,东北,2300,"侨诚花园,海珠,南洲,距2号线东晓南站约374米,工业大道南253号",精装修,本人实拍 东晓南地铁口 侨城花园电梯一房 家电齐全 拎包入住
2室2厅1卫,68平米,中层,整租,南,5300,"芭堤水岸,海珠,滨江东,距8号线鹭江站约974米,滨江东路环月街2号",精装修,芭堤水岸:精装两房 家电齐全 厅出阳台望花园 随时约看
1室1厅1卫,30平米,低层,整租,西南,2000,"沙园广重小区,海珠,工业大道北,距广佛线沙园站约482米,海珠区沙园路四街北1-3号，五街北1-3号，六街北1",豪华装修,沙园站 一房一厅 豪华装修 家私电齐全 拎包即住
2室1厅1卫,58平米,高层,整租,东南,2400,"保利红棉花园,海珠,江燕路,距广佛线燕岗站约600米,工业大道中江燕路353号",精装修,保利红棉 家电齐全，精装两房 拎包入住，只租2400元
1室1厅1卫,50平米,中层,整租,东南,2200,"市二宫小区,海珠,江南大道,距2号线市二宫站约85米,市二宫地铁口附近",精装修,市二宫小区，一房一厅，租2200元
3室2厅1卫,117平米,低层,整租,南北,8500,"保利天悦,海珠,琶洲,距8号线万胜围站约771米,阅江路琶洲塔公园旁",豪华装修,保利天悦 诚信房源 南向三方 家电齐全 可用 保养新净 有档次
4室2厅2卫,146平米,高层,整租,南,7200,"富力千禧花园,海珠,新港西,距8号线晓港站约455米,东晓南路与新港西路交汇处",中装修,富力千禧三期 4房出租7200元 中大 生活方便 小区管理
3室1厅1卫,106平米,高层,整租,南,5500,"光大花园二期,海珠,工业大道北,距广佛线沙园站约590米,工业大道北榕景路",简装修,光大花园 三房 人车分流 型花园 近地铁
3室1厅1卫,92平米,高层,整租,南,3200,"革新路小区,海珠,工业大道北,距8号线凤凰新村站约412米,工业大道北革新路",简装修,革新路三房 户型好 采光好 看房方便 有大阳台
3室1厅1卫,80平米,高层,整租,南,4000,"海康街小区,海珠,新港西,距8号线鹭江站约489米,新港西路海康街",豪华装修,海康街小区，豪华装修，真的给你不一样的感受
3室2厅1卫,150平米,中层,整租,北,9000,"高雅湾,海珠,滨江东,滨江东路318号、怡福路247路、文晖街1号-5号（",简装修,滨江东高雅湾 户型好，中大北门旁，随时看房
3室2厅2卫,105平米,高层,整租,南,8000,"保利天悦,海珠,琶洲,距8号线万胜围站约771米,阅江路琶洲塔公园旁",豪华装修,保利天悦，新收，三房租两房的租价，随时看房拎包入住手快有
3室2厅1卫,105平米,中层,整租,北,9000,"保利天悦,海珠,琶洲,距8号线万胜围站约771米,阅江路琶洲塔公园旁",豪华装修,保利天悦 精装南北3房 品质小区 全新家私 拎包入住近
1室1厅1卫,38平米,中层,整租,南,3200,"金盛大厦,海珠,昌岗路,距2号线昌岗站约208米,昌岗中路243号",精装修,金盛大厦 拎包入住，单身女孩大爱的房子，简单舒适干净！！！
1室0厅1卫,35平米,低层,整租,南北,2200,"丽海雅居,海珠,滨江中,距6号线东湖站约1056米,海珠区滨江中路东沙街28号至38号",豪华装修,丽海雅居 精装一房 干净整洁 家私电器齐 只需2200 拎包即可入住
3室2厅1卫,108平米,高层,整租,西北,8500,"保利天悦,海珠,琶洲,距8号线万胜围站约771米,阅江路琶洲塔公园旁",精装修,绝世好房 保利天悦望江3室 8500元享受 高层贼安静！
3室2厅2卫,110平米,高层,整租,南北,7000,"影城花园,海珠,客村,距8号线客村站约237米,新港中路350号",豪华装修,影城花园 房东自住型装修 照片 干净清爽 拎包记住
3室2厅2卫,121平米,低层,整租,南北,8000,"世纪云顶雅苑,海珠,滨江东,距3号线客村站约845米,云顶街19至27号",豪华装修,世纪云顶雅苑 3室2厅2卫 带精装 拎包入住
3室1厅1卫,108平米,低层,整租,南,8500,"滨江1933,海珠,滨江西,距2号线海珠广场站约688米,滨江西路200号",豪华装修,豪华装修 小区环境优美 修身养性
3室2厅1卫,105平米,高层,整租,南北,8500,"保利天悦,海珠,琶洲,距8号线万胜围站约771米,阅江路琶洲塔公园旁",精装修,保利天悦，全新豪华装修高层江景，家私电器齐全，拎包入住随时看
2室1厅1卫,78平米,中层,整租,北,4000,"丽园雅庭,海珠,客村,距8号线客村站约514米,新港中路409号",精装修,客村中心，精装修电梯2房，家具齐全，拎包入住
2室2厅1卫,64平米,中层,整租,南,3000,"保利红棉花园,海珠,江燕路,距广佛线燕岗站约600米,工业大道中江燕路353号",精装修,江燕路 近地铁 保利红棉花园 中层精装两房 温馨家的感觉
2室2厅1卫,72平米,中层,整租,东南,3800,"光大花园,海珠,工业大道北,距广佛线沙园站约510米,工业大道北榕景路122号",精装修,光大花园 精装两房 小区环境好 家电齐全 拎包入住
1室1厅1卫,40平米,高层,整租,南,2000,"同福中路小区,海珠,宝岗,距2号线市二宫站约692米,南华西同福中路",简装修,市二宫 家私电器齐全 上下两层
3室2厅2卫,120平米,中层,整租,南北,6000,"经典居,海珠,滨江东,距3号线客村站约852米,广州市海珠区桃花街159号",简装修,经典居3室 用我真诚的服务 包您的满意!
3室2厅2卫,130平米,中层,整租,南北,8800,"保利天悦,海珠,琶洲,距8号线万胜围站约771米,阅江路琶洲塔公园旁",精装修,保利天悦，精装大三房望园林，家私家电齐全拎包入住，随时可看房
2室2厅1卫,96平米,中层,整租,西南,4800,"世纪云顶雅苑,海珠,滨江东,距3号线客村站约845米,云顶街19至27号",豪华装修,世纪云顶雅苑 整洁两房 家电齐全 小区有匙即看!
1室0厅1卫,42平米,中层,整租,南,3500,"珠江新岸公寓,海珠,滨江东,距APM线广州塔站约975米,滨江东路玉涵路28号",豪华装修,珠江新岸3500月租 看房方便 随时入住
5室2厅4卫,210平米,中层,整租,南北,15000,"雅郡花园,海珠,琶洲,距4号线万胜围站约510米,新港东路48号",豪华装修,雅郡花园 温馨5室 住家装修 价 仅租15000元
3室1厅1卫,108平米,中层,整租,东北,5200,"金丰大厦,海珠,赤岗,距8号线赤岗站约1191米,赤岗路173之2号",简装修,"金丰大厦3室空间布局有致,和谐有序,清新空气自由穿行"
2室1厅1卫,56平米,中层,整租,东南,3200,"晓城大厦,海珠,东晓南,距2号线东晓南站约170米,海珠区东晓南路英华街159号",精装修,东晓南晓城大厦 电梯两房 家电齐全 中层望花园 生活舒适
2室1厅1卫,90平米,低层,整租,南,4000,"新港东电力设计院宿舍,海珠,赤岗,距8号线磨碟沙站约303米,海珠区新港东路88至90号",简装修,电力设计院 电梯大两房 出行方便 南向 家私家电齐全 业主急租
2室2厅1卫,105平米,低层,整租,南,5000,"雅郡花园,海珠,琶洲,距4号线万胜围站约510米,新港东路48号",精装修,雅郡花园，大两房出租，南向望别墅，家私电器齐全拎包入住随时看
3室2厅1卫,98平米,低层,整租,东南,5500,"光大花园,海珠,工业大道北,距广佛线沙园站约510米,工业大道北榕景路122号",精装修,光大花园和榕风景5500元/月 3房2厅 家私家电齐全
3室2厅2卫,119平米,低层,整租,东北,5600,"海珠半岛花园,海珠,滨江东,滨江东路543-549号",豪华装修,海珠半岛二期 东向3房 望花园望江 有匙即看 拎包入住
2室1厅1卫,68平米,中层,整租,西北,5600,"芭堤水岸,海珠,滨江东,距8号线鹭江站约974米,滨江东路环月街2号",精装修,芭堤水岸两房 北向望花园望江 家私家电齐全 随时看房
3室2厅2卫,108平米,高层,整租,南,3800,"珠江御景湾,海珠,南洲,华南快速干线瀛洲生态园",精装修,珠江御景湾 电梯三房 家私家电齐全
1室1厅1卫,33平米,高层,整租,北,1800,"晓港湾,海珠,南洲,距2号线东晓南站约161米,海珠区东晓南路与侨港路交界处",精装修,照片 紧急出租晓港湾精品一房 精装 家电齐全拎包入住
1室1厅1卫,56平米,低层,整租,南,4300,"琶洲新村,海珠,琶洲,距8号线万胜围站约351米,海珠区新港东路",豪华装修,琶洲新村 南向一房 家私简洁 图片实拍 看房有钥匙
4室2厅4卫,286平米,高层,整租,南,25000,"保利天悦,海珠,琶洲,距8号线万胜围站约771米,阅江路琶洲塔公园旁",豪华装修,保利天悦 高层江景住宅 一梯一户 286平方 4房2厅 随时看房价可谈
5室2厅2卫,163平米,高层,整租,东南,8000,"珠江帝景苑,海珠,赤岗,距APM线广州塔站约591米,新港中路艺苑路99号",豪华装修,珠江帝景赏湖轩 实用五房 安静望花园 豪华装修 拎包入住
2室2厅1卫,92平米,高层,整租,南,5300,"琶洲新村,海珠,琶洲,距8号线万胜围站约351米,海珠区新港东路",精装修,琶洲新村 正规92方大两房 精装修 保养新净 高层景观靓
1室1厅1卫,42平米,高层,整租,南,2000,"第三金碧花园,海珠,工业大道南,距2号线东晓南站约990米,工业大道南821号",精装修,第三金碧花园 家电家具齐全 干净整洁 拎包入住
2室1厅1卫,80平米,中层,整租,南,3800,"江南西玫瑰园,海珠,江南西,距2号线江南西站约462米,江南西路青竹大街23号",精装修,低价出租 随时带看 2室3800元
5室2厅3卫,186平米,中层,整租,东南,19000,"珠江帝景紫龙府,海珠,赤岗,距APM线广州塔站约349米,新港中路艺苑路99号",精装修,百闻不如一见！珠江帝景紫龙府简约轻奢5室献给懂得享受得你
2室1厅1卫,74平米,高层,整租,东南,3800,"牛奶厂街小区,海珠,宝岗,距8号线凤凰新村站约911米,同福中路牛奶厂街",中装修,牛奶厂街 电梯两房 东南向 采光好
2室2厅1卫,68平米,中层,整租,北,3800,"保利花园,海珠,工业大道南,距广佛线燕岗站约635米,工业大道中400号",精装修,保利花园 实用2房家 私电器齐全 随时伶包入住 小区环境好
1室1厅1卫,49平米,低层,整租,东,3300,"罗马家园,海珠,沥滘,距3号线沥滘站约798米,海珠区南洲路88号",简装修,罗马家园 1房1厅 舒适新净 拎包入住
3室1厅1卫,105平米,高层,整租,南,3600,"南华中路小区,海珠,滨江西,距6号线一德路站约721米,海珠区南华中路",中装修,温馨如家 阳光充足 干净卫生
2室1厅1卫,65平米,低层,整租,南,3000,"赤岗丽景花园,海珠,赤岗,距8号线磨碟沙站约443米,新港东路38号至72号",精装修,丽景花园 两房一厅 温馨两房 交通方便 家私家电齐全
1室1厅1卫,50平米,中层,整租,东,3000,"罗马家园,海珠,沥滘,距3号线沥滘站约798米,海珠区南洲路88号",精装修,罗马家园 地铁三号线 精装大单间出租
1室1厅1卫,68平米,中层,整租,东北,5800,"保利天悦,海珠,琶洲,距8号线万胜围站约771米,阅江路琶洲塔公园旁",豪华装修,保利天悦 1房1厅 豪华装修拎包入住 高层望江
2室2厅1卫,88平米,中层,整租,东北,3600,"滨江瑞城,海珠,南洲,距2号线东晓南站约357米,东晓南路宝成街6-10号（双号）",豪华装修, 东晓南口 瑞宝花园 滨江瑞城 精装大两房家电齐
4室2厅3卫,203平米,中层,整租,南北,16000,"保利天悦,海珠,琶洲,距8号线万胜围站约771米,阅江路琶洲塔公园旁",豪华装修,保利天悦住宅 203平高层南北向四房 景观视野开阔 保养新
2室1厅1卫,56平米,中层,整租,南,2600,"昌岗中路小区,海珠,昌岗路,距2号线昌岗站约9米,海珠区昌岗中路",中装修,全新装修，家私家电配新齐全，中层，
2室2厅1卫,84平米,高层,整租,南,3800,"第三金碧花园,海珠,工业大道南,距2号线东晓南站约990米,工业大道南821号",精装修,工业大道南金碧三期 精装电梯南向大两房 干净整洁 温馨舒适 价低
2室2厅1卫,75平米,中层,整租,南北,4800,"珠光高派,海珠,滨江东,距8号线鹭江站约851米,滨江东路586号",精装修,珠光高派华庭 存在 精装两房 随时看房
3室2厅2卫,110平米,中层,整租,南北,5200,"逸景翠园,海珠,广州大道南,距3号线大塘站约1081米,广州大道南1028号",精装修,逸景翠园 精装温馨3房 温馨舒适 家电齐全 业主自住
2室2厅1卫,82平米,低层,整租,南,4300,"海富花园,海珠,江燕路,距2号线江泰路站约420米,江南大道南江燕路20号",精装修,海富花园精装2室，家电齐全，清爽装修，拎包温馨入住
2室1厅1卫,50平米,低层,整租,东,2700,"赤岗一街小区,海珠,赤岗,距8号线赤岗站约805米,新港中路赤岗一街",精装修,赤岗路 低层精装二房 全新装修 随时可看房
1室1厅1卫,60平米,中层,整租,南北,4200,"纵横国际公寓,海珠,赤岗,距8号线客村站约687米,新港中路南毛纺厂宿舍区",精装修,赤岗地鉄口 纵横 南北对流 高层采光通透 拎包入住 家电齐全 约看
1室1厅1卫,48平米,中层,整租,南,1900,"西基东路小区,海珠,江南西,距8号线宝岗大道站约677米,宝岗大道西基东路",精装修,江南西 西基东小区 正规一房一厅 家私电器齐全 拎包入住
3室2厅2卫,120平米,中层,整租,南,5400,"可逸家园,海珠,江南大道,距8号线宝岗大道站约692米,江南西路青柳大街",精装修,可逸家园 小区管理 3房带主套 阳台望花园
2室2厅1卫,68平米,中层,整租,南,2800,"江燕花园,海珠,江燕路,距2号线江泰路站约340米,江燕路134-152双号",精装修,江燕花园 电梯温馨两房 家电家私齐全 拎包入住
4室2厅2卫,183平米,高层,整租,北,16000,"滨江明珠,海珠,滨江东,距8号线鹭江站约1039米,海珠区滨江路209号",简装修,滨江明珠 与二沙岛隔江相望交通方便，一线望江
4室2厅2卫,267平米,高层,整租,南,25000,"信达阳光海岸,海珠,滨江东,距8号线鹭江站约918米,海珠区滨江东路信泰街1至9号",精装修,信达阳光海岸滨江东顶及豪宅 全新装修未住过 180度望珠江
3室1厅1卫,72平米,高层,整租,南,3300,"穗发花园,海珠,新港西,距8号线中大站约548米,新港西路142号",精装修,穗发精装三房出租 新家私电梯
4室2厅2卫,147平米,高层,整租,南,8500,"珠光高派,海珠,滨江东,距8号线鹭江站约851米,滨江东路586号",精装修,珠光高派 精装四房 看房方便 南北对流 家私家电齐全 中高楼层
2室2厅1卫,80平米,高层,整租,南,4500,"琶洲新村,海珠,琶洲,距8号线万胜围站约351米,海珠区新港东路",精装修,琶洲新村 舒适两房 家电齐全 生活便利 干净舒适 随时看房
2室2厅1卫,80平米,低层,整租,南,3000,"南贤大街小区,海珠,新港西,距8号线客村站约775米,新港西路南贤大街43号至59号",简装修,大江苑南贤大街 2室2厅 3000元
2室2厅1卫,85平米,高层,整租,南北,3600,"江景苑,海珠,滨江东,距8号线鹭江站约545米,海珠区下渡路164号",中装修,新港西中等装修南北通透85平好格局便宜急租
4室2厅2卫,137平米,中层,整租,南,4800,"鸣翠花园,海珠,工业大道南,距2号线东晓南站约1070米,工业大道南694号",豪华装修,鸣翠花园四期 电梯大四房 16年楼龄 拎包入住11.28
3室2厅2卫,112平米,中层,整租,南北,8500,"保利天悦,海珠,琶洲,距8号线万胜围站约771米,阅江路琶洲塔公园旁",精装修,保利天悦，精装南向三房，家私家电齐全拎包入住，有钥匙随时可看
3室2厅1卫,108平米,中层,整租,南,3700,"南洲花苑,海珠,南洲,距2号线南洲站约977米,广州大道南南洲北路",精装修,南洲花苑低楼层 采光生猛 精装家电齐全 有钥匙看房
3室2厅2卫,110平米,高层,整租,东南,6000,"雅郡花园,海珠,琶洲,距4号线万胜围站约510米,新港东路48号",豪华装修,雅郡花园大型社区 低密度花园小区 漂亮3房 拎包入住
1室0厅1卫,35平米,中层,整租,南北,3000,"蓝色康园,海珠,滨江东,距8号线鹭江站约989米,滨江东路562号",精装修,蓝色康园 高质小区 温馨新净一房带阳台 配置齐全 随时入住
1室1厅1卫,51平米,低层,整租,南,4500,"邦泰国际公寓,海珠,琶洲,距8号线磨碟沙站约383米,新港东路43号至55号(单号)、43号之一、43号之",简装修,邦泰国际 复/式大一房 可 电商旁 地鉄上/盖
2室1厅1卫,70平米,低层,整租,东西,2900,"福景居,海珠,赤岗,距8号线客村站约1136米,新港中路赤岗路160号至200号",简装修,福景居 2室1厅1卫，温馨入住。家电齐全 。
1室1厅1卫,60平米,低层,整租,南,4000,"琶洲新村,海珠,琶洲,距8号线万胜围站约351米,海珠区新港东路",精装修,琶洲新村 一房一厅 租4000元 带家私，家电 拎包入住
2室2厅1卫,75平米,高层,整租,南,3500,"爱都铭轩,海珠,东晓南,距2号线南洲站约299米,东晓南路5号",精装修,南洲爱都铭轩 精装电梯南向大两房 保养新净 家电齐全 通风采光好
1室1厅1卫,38平米,中层,整租,东南,3400,"琶洲新村,海珠,琶洲,距8号线万胜围站约351米,海珠区新港东路",精装修,琶洲新村，小单间拎包入住，交通便利配套成熟，高层采光好随时看
3室2厅2卫,107平米,中层,整租,南北,5288,"逸景翠园,海珠,广州大道南,距3号线大塘站约1081米,广州大道南1028号",精装修,逸景翠园新装修大三房，大家不要错过哦！
3室2厅2卫,112平米,高层,整租,东南,4600,"保利花园,海珠,工业大道南,距广佛线燕岗站约635米,工业大道中400号",豪华装修,保利花园3室 户型正气 装修干净清爽 价格 拎包入住
3室1厅1卫,99平米,中层,整租,南北,6200,"七所社区,海珠,客村,距3号线客村站约308米,新市头路375号",精装修,客村出口电子七所精装3室交通方便安静舒适拎包入住
3室2厅1卫,97平米,高层,整租,南,4500,"第一金碧花园,海珠,工业大道南,距2号线东晓南站约845米,工业大道南821号",毛坯,金碧花园一期都市三房厅直出阳台家私电齐全地铁
2室1厅1卫,85平米,中层,整租,西北,6000,"富力金禧花园,海珠,宝岗,距6号线一德路站约816米,南华中路221号",简装修,电梯两房 放盘
2室1厅1卫,65平米,中层,整租,东南,3600,"新城国际寓,海珠,工业大道南,距2号线东晓南站约791米,江南大道南与工业大道南交汇（第一金碧旁）",精装修,东晓南站 复式两房 全新装修家电齐拎包入住
2室2厅1卫,80平米,中层,整租,西南,3900,"海珠江丽苑,海珠,滨江东,距8号线鹭江站约770米,广州大道南翠竹路36号",简装修,南向两房，采光足通风好，装修保养好
2室1厅1卫,60平米,中层,整租,南北,2500,"逸民里,海珠,滨江中,距6号线东湖站约1037米,海珠区远安新街逸民里",豪华装修,"温暖又温心,逸民里豪华装修2室只需2500 有匙即睇"
2室2厅1卫,78平米,中层,整租,南,3600,"金碧花园,海珠,工业大道南,距2号线东晓南站约845米,工业大道南821号",精装修,金碧花园第三花园 格局方正 装修保养好 近口 拎包入住
2室1厅1卫,55平米,高层,整租,南,3000,"金玫瑰苑,海珠,工业大道南,距2号线东晓南站约592米,工业大道997号",精装修,存在 东晓南南州口 金玫瑰苑 电梯两房家电齐拎包入住
2室2厅1卫,72平米,高层,整租,西南,4500,"富力尚溢居,海珠,滨江东,距8号线中大站约856米,怡乐路二巷5号",精装修,富力尚溢居：高层视野开阔望江2房 保养新净 方便看
2室1厅1卫,66平米,中层,整租,南,2600,"保利红棉花园,海珠,江燕路,距广佛线燕岗站约600米,工业大道中江燕路353号",精装修,江燕路，保利红棉，精装两房，低楼层，通风采光好，户型方正
2室2厅1卫,89平米,高层,整租,东南,5500,"琶洲新村,海珠,琶洲,距8号线万胜围站约351米,海珠区新港东路",精装修,琶洲新村，东南向大两房，全新家私电器齐全，随时拎包入住随时看
3室2厅2卫,100平米,中层,整租,南,4800,"东翠花园,海珠,滨江中,距8号线中大站约1153米,海珠区海联路东翠南街2-30号",精装修,东翠花园 家私家电齐 干净舒适漂亮 屋子通风采光好
2室1厅1卫,75平米,中层,整租,南,3500,"南园居教师村,海珠,琶洲,距8号线琶洲站约390米,新港东路南园居（琶洲地铁站往东200米）",简装修,琶洲 南园居 安静2房 配私 中低楼层
2室1厅1卫,70平米,低层,整租,南,3300,"西基东路小区,海珠,江南西,距8号线宝岗大道站约677米,宝岗大道西基东路",精装修,家私家电齐 采光好 生活便利 小区管理 近地铁
4室2厅2卫,187平米,高层,整租,南,15000,"珠江帝景紫龙府,海珠,赤岗,距APM线广州塔站约349米,新港中路艺苑路99号",豪华装修,珠江帝景紫龙府 全新装修四房 家具新买 小区 拎包住
3室2厅2卫,125平米,低层,整租,南,6000,"丽海雅居,海珠,滨江中,距6号线东湖站约1056米,海珠区滨江中路东沙街28号至38号",简装修,滨江中 丽海雅居 江边小区 南向 精装大三房 家私电器齐 拎包入住
2室2厅1卫,85平米,中层,整租,南,3500,"江南西小区,海珠,江南西,距2号线江南西站约202米,江南西路",精装修,哇 江南西地头 全新装修 全新家私家电 周边配套齐全 环境好
2室1厅1卫,68平米,中层,整租,东北,3200,"晓港湾漾日云天,海珠,南洲,距2号线东晓南站约291米,海珠区东晓南路",精装修,本人实拍 东晓南 晓港湾漾日云天 电梯两房 家电齐拎包住
2室1厅1卫,88平米,高层,整租,东南,5500,"亿海湾,海珠,滨江西,距6号线一德路站约693米,南华中路297-319号",精装修,亿海湾 两房一厅 住家装修 看房方便
2室1厅1卫,75平米,中层,整租,南,2700,"紫来大街小区,海珠,江南西,距2号线江南西站约180米,海珠区江南西紫来大街",精装修,家私家电齐全 大街大巷 采光好 近地铁 生活便利 小区管理
2室2厅1卫,88平米,高层,整租,东北,5500,"珠江新岸公寓,海珠,滨江东,距APM线广州塔站约975米,滨江东路玉涵路28号",豪华装修,珠江新岸 别致二房 家具配齐 全新装修 江边
2室1厅1卫,45平米,中层,整租,南,2800,"南华中路小区,海珠,滨江西,距6号线一德路站约721米,海珠区南华中路",简装修,3楼 省时省力的
3室2厅1卫,101平米,中层,整租,南北,7000,"亿海湾,海珠,滨江西,距6号线一德路站约693米,南华中路297-319号",豪华装修,好房子不是这么容易找的 业主说不好的租客我是不会租的
3室2厅2卫,127平米,高层,整租,南,6500,"珠江帝景苑,海珠,赤岗,距APM线广州塔站约591米,新港中路艺苑路99号",精装修,珠江帝景 豪装三房 望花园 安静舒适 看房方便
2室2厅1卫,73平米,中层,整租,南,4300,"经典居,海珠,滨江东,距3号线客村站约852米,广州市海珠区桃花街159号",简装修,经典居 能自住能 正规两房 看房方便 我有钥匙
3室1厅2卫,109平米,高层,整租,南,2800,"郭墩街小区,海珠,滨江中,距2号线江南西站约1122米,江湾路郭墩新街",简装修,大三房带主套，拎包入住，小区管理
2室1厅1卫,78平米,中层,整租,南,3800,"光大花园,海珠,工业大道北,距广佛线沙园站约510米,工业大道北榕景路122号",精装修,光大花园 一年前装修 保养干净舒适 住的舒适
2室1厅1卫,86平米,中层,整租,南,6000,"富力金禧花园,海珠,宝岗,距6号线一德路站约816米,南华中路221号",简装修,家具家电全齐 拎包即住 中楼层带电梯 新房装修出租 先到先得
4室2厅1卫,320平米,高层,整租,南,12000,"世港国际公寓,海珠,琶洲,距8号线磨碟沙站约538米,新港东路192至198号",精装修,世港国际 豪华二百五十平方 专用 价格面议
4室2厅2卫,250平米,中层,整租,南北,11000,"中信君庭,海珠,滨江东,距8号线鹭江站约971米,滨江东路下渡路49号",简装修,超级，中信君庭全新一般装修4室，舒适的享受
2室2厅2卫,76平米,中层,整租,南北,2350,"大家庭花园,海珠,琶洲,距8号线琶洲站约402米,新港东庭园路91至111号",精装修,大家庭花园口，户型方正，家私家电齐全，随时拎包入住
2室2厅1卫,57平米,高层,整租,北,3500,"利安花园,海珠,客村,距APM线广州塔站约202米,艺苑路利安一街",简装修,利安花园精装两房拎包入住广州塔站
2室2厅1卫,75平米,中层,整租,东南,2800,"江南苑,海珠,工业大道北,距广佛线沙园站约408米,荔福路33号",豪华装修,！江南苑 家电家具齐全 干净整洁，拎包入住
